{
  "actor": "t02-fixture",
  "timestamp": "2026-10-17T00:00:00Z",
  "input_hashes": [
    "sha256:0123456789abcdef0123456789abcdef0123456789abcdef0123456789abcdef"
  ],
  "machine": "dataset",
  "from": "DISCOVERED",
  "event": "rights_cleared",
  "to": "RIGHTS_CLEARED",
  "disposition": "recorded"
}
